{
  "$schema": "https://json-schema.org/draft/2020-12/schema",
  "$id": "proposal-review-criteria-schema.json",
  "title": "Proposal Review Criteria Schema",
  "description": "Schema for .claude/metadata/proposal-review-criteria.json — criteria for /review-proposal",
  "type": "object",
  "required": ["version", "criteria"],
  "properties": {
    "$schema": {
      "type": "string"
    },
    "version": {
      "type": "string",
      "description": "Criteria version"
    },
    "criteria": {
      "type": "array",
      "description": "Review criteria for proposals",
      "items": {
        "type": "object",
        "required": ["id", "name", "description", "type", "autoCheckMethod"],
        "properties": {
          "id": { "type": "string" },
          "name": { "type": "string" },
          "description": { "type": "string" },
          "type": { "type": "string", "enum": ["objective", "subjective"] },
          "autoCheckMethod": { "type": "string" },
          "gate": { "type": "boolean", "description": "Whether this criterion gates the review (stops evaluation if missing)" }
        },
        "additionalProperties": false
      }
    },
    "subjective": {
      "type": "array",
      "description": "Subjective criteria requiring user input",
      "items": {
        "type": "object",
        "required": ["id", "name", "question", "header", "options"],
        "properties": {
          "id": { "type": "string" },
          "name": { "type": "string" },
          "question": { "type": "string" },
          "header": { "type": "string" },
          "options": {
            "type": "array",
            "items": {
              "type": "object",
              "required": ["label", "description"],
              "properties": {
                "label": { "type": "string" },
                "description": { "type": "string" }
              },
              "additionalProperties": false
            }
          },
          "partialReviewNote": { "type": "string" }
        },
        "additionalProperties": false
      }
    },
    "_meta": {
      "type": "object",
      "description": "Metadata about this criteria file"
    }
  },
  "additionalProperties": false
}
