{
  "$schema": "./proposal-review-criteria-schema.json",
  "version": "1.0",
  "criteria": [
    {
      "id": "required-sections",
      "name": "Required sections present",
      "description": "Check for standard proposal sections",
      "type": "objective",
      "autoCheckMethod": "Check for: Problem Statement, Proposed Solution, Acceptance Criteria, Out of Scope sections"
    },
    {
      "id": "status-field",
      "name": "Status field present",
      "description": "Check for status metadata field",
      "type": "objective",
      "autoCheckMethod": "Check for `**Status:**` metadata field"
    },
    {
      "id": "cross-references-valid",
      "name": "Cross-references valid",
      "description": "Verify file paths mentioned in proposal exist on disk",
      "type": "objective",
      "autoCheckMethod": "Verify any file paths mentioned in the proposal exist on disk"
    },
    {
      "id": "acceptance-criteria-defined",
      "name": "Acceptance criteria defined",
      "description": "Check for checkbox items or numbered criteria",
      "type": "objective",
      "autoCheckMethod": "Check for `- [ ]` checkbox items or numbered criteria list"
    },
    {
      "id": "prerequisites-documented",
      "name": "Prerequisites documented",
      "description": "Check for prerequisites or dependencies section",
      "type": "objective",
      "autoCheckMethod": "Check for prerequisites/dependencies section if applicable"
    },
    {
      "id": "no-internal-contradictions",
      "name": "No internal contradictions",
      "description": "Verify solution addresses stated problem without contradictions",
      "type": "objective",
      "autoCheckMethod": "Verify solution addresses the stated problem; out-of-scope items not duplicated in solution"
    },
    {
      "id": "solution-detail-sufficient",
      "name": "Solution detail sufficient for implementation",
      "description": "Check for concrete implementation details",
      "type": "objective",
      "autoCheckMethod": "Check for named files, APIs, data structures, or implementation steps (not just high-level prose)"
    },
    {
      "id": "alternatives-considered",
      "name": "Alternatives considered",
      "description": "Check for alternatives or tradeoffs section",
      "type": "objective",
      "autoCheckMethod": "Check for alternatives/tradeoffs section documenting at least one rejected approach"
    },
    {
      "id": "impact-assessment",
      "name": "Impact assessment present",
      "description": "Check for impact, risk, or effort section",
      "type": "objective",
      "autoCheckMethod": "Check for impact/risk/effort section covering scope, risk, and estimated effort"
    },
    {
      "id": "criteria-match-solution",
      "name": "Implementation criteria match solution",
      "description": "Cross-reference ACs against proposed solution",
      "type": "objective",
      "autoCheckMethod": "Cross-reference AC items against the proposed solution — each AC should map to a solution element"
    },
    {
      "id": "edge-cases-addressed",
      "name": "Edge cases and error handling addressed",
      "description": "Check for error handling or failure mode sections",
      "type": "objective",
      "autoCheckMethod": "Check for error handling, edge case, or failure mode sections"
    },
    {
      "id": "proposal-self-contained",
      "name": "Proposal self-contained",
      "description": "Check that external references are explained inline",
      "type": "objective",
      "autoCheckMethod": "Check if external references (URLs, other repos, tools) are explained inline without requiring context"
    },
    {
      "id": "writing-clear",
      "name": "Writing clear and unambiguous",
      "description": "Evaluate prose for vague or ambiguous language",
      "type": "objective",
      "autoCheckMethod": "Evaluate prose for vague language (\"should work\", \"might need\", \"probably\"), undefined terms, or ambiguous scope"
    },
    {
      "id": "command-claim-feasible",
      "name": "Commands named in decisions can do what is claimed",
      "description": "Verify every slash command a decision names is actually scoped to the work the decision assigns it",
      "type": "objective",
      "autoCheckMethod": "For each decision in the proposal, extract every slash command it names (pattern `/[a-z][a-z0-9-]*`). For each, read `CommandsSrc/<command>.md` and confirm that command's documented scope covers the capability the decision claims for it. Report a fail naming the decision, the command, and the gap when it does not. The discriminator that is easiest to miss is *which artifact* a review command reads: `/review-issue` reviews an issue **as a specification** — its story criteria evaluate user-story format, AC presence, AC testability, scope, and body template, and nothing in it evaluates implemented content; `/code-review` is the command that reviews implemented **source files**. A decision reading \"AI-written, user-reviewed via the normal `/review-issue` flow\" is therefore infeasible as written, and every AC generated from it inherits the defect (#2508). Also flag decisions naming a command for work another command's checklist already owns (CHANGELOG, tagging, release publication belong to `/prepare-release`)."
    },
    {
      "id": "technical-feasibility",
      "name": "Technical feasibility",
      "description": "Assess whether the proposed solution is technically achievable",
      "type": "objective",
      "autoCheckMethod": "Assess whether the proposed solution is technically achievable. Check for: technical complexity and risk factors (novel tech, unproven approaches, scaling concerns), dependency availability and compatibility (external libraries, APIs, services), scope clarity and implementation feasibility (can the solution be built as described?), resource/effort proportionality (is the effort reasonable for the value?). Present any feasibility concerns with evidence."
    },
    {
      "id": "test-coverage-proportionate",
      "name": "Test coverage proportionate",
      "description": "Check that testing strategy is proportionate to scope",
      "type": "objective",
      "autoCheckMethod": "When scope is non-trivial (multiple files, refactoring, new modules), check that the proposal mentions a testing strategy or includes test-related acceptance criteria. For simple single-file changes, testing mention is preferred but not required. Report scope assessment vs testing mentions with evidence."
    },
    {
      "id": "diagrams-verified",
      "name": "Diagrams verified",
      "description": "Verify referenced diagram files exist on disk",
      "type": "objective",
      "autoCheckMethod": "If `**Diagrams:**` field lists file paths (not \"None\"), verify each referenced file exists on disk. Report missing files as fail. If field is \"None\" or absent, skip this check (not an error)."
    },
    {
      "id": "path-analysis-present",
      "name": "Path Analysis present",
      "description": "Check for Path Analysis section in proposal — gates review if missing",
      "type": "objective",
      "gate": true,
      "autoCheckMethod": "Check for `## Path Analysis` section in proposal document. If present: ✅, continue normally. If missing: STOP evaluation and present AskUserQuestion with options: (1) \"Run /paths now (Recommended)\" — invoke `/paths #N`, then re-evaluate this criterion; (2) \"Continue without\" — record as ⚠️ and proceed. See review-proposal.md Step 2a-gate for flow details."
    },
    {
      "id": "screen-coverage",
      "name": "Screen coverage (UI proposals)",
      "description": "Check for screen specs or mockups in UI-related proposals",
      "type": "objective",
      "autoCheckMethod": "If the proposal mentions screens, UI, forms, or user interface elements, check for `## Screen Specs` or `## Mockups` sections. If screens are mentioned but no specs/mockups are referenced, flag. If the proposal is CLI-only, API-only, or has no UI references, skip this check entirely."
    },
    {
      "id": "prior-art-checked",
      "name": "Prior art checked",
      "description": "Proposal records that a prior-art sweep ran",
      "type": "objective",
      "autoCheckMethod": "Delegate to decideSweep in .claude/scripts/shared/lib/prior-art-marker.js and report the status it returns; do not re-derive the rule here. The marker itself is the literal '**Prior Art:**' heading defined by .claude/metadata/prior-art-sweep.json bodyFormat.heading; present and complete = pass. Proposals created before the cutoff in that helper are not applicable rather than failing. Behavior past that depends on framework-config.json reviewSweep, a 4-mode setting since #2564 (absent = 'recommend'): under 'full' an absent or PARTIAL marker reports fail and runs the prior-art sweep step; under 'recommend' it reports the advisory status 'recommend' and runs NO sweep — this must NOT be reported as fail, because --prior-art is opt-in and rarely passed, so most proposals carry no marker and a fail would downgrade nearly every review; under 'flag-only' and 'off' report skip, not fail, which would downgrade every review in a project that opted out."
    },
    {
      "id": "charter-alignment",
      "name": "Aligned with the charter",
      "description": "proposal title, problem statement and proposed solution compared against CHARTER.md In Scope, Out of Scope and Current Focus",
      "type": "objective",